{"artifacts":[{"component":"aa-moonmining","distribution":"aa-moonmining","filename":"aa_moonmining-3.1.0.post1-py3-none-any.whl","git_blob_sha":"381062cce2aa1d38dfc56123dff132198d0fd50e","kind":"third-party","origin":"reused","reused_from":"0.8.2","sha256":"aa4ddbc7da64151cd6d988d971d59462360e35a5111d47a3bf56d577f454bc13","size":326542,"version":"3.1.0.post1"},{"component":"aa-structures","distribution":"aa-structures","filename":"aa_structures-4.0.3-py3-none-any.whl","git_blob_sha":"95854c4ac5bc74d6acda97c08653d02e0cee75be","kind":"third-party","origin":"reused","reused_from":"0.8.2","sha256":"ba8493ef10a450198fa5ba3d8995e1ea661b74dca20d770beaa91bf005f558e3","size":965451,"version":"4.0.3"},{"component":"esi-history","distribution":"aa-buh-max-history","filename":"aa_buh_max_history-2.1.2-py3-none-any.whl","import_name":"buh_max_history","input_sha256":"af01fbd14df55be2e6d25a7d814c31c85bb66256351483051ef923dfa0a0ad72","kind":"owned","origin":"reused","reused_from":"0.8.2","sha256":"adf116b02f024344da47190103078697523f71ae60412934f5e09506a36f80f5","size":98148,"version":"2.1.2"},{"component":"memberaudit-autoreg","distribution":"aa-buh-memberaudit-autoreg","filename":"aa_buh_memberaudit_autoreg-0.1.1-py3-none-any.whl","import_name":"buh_memberaudit_autoreg","input_sha256":"0f521ddca115f0fa5467af384b2084c7e822f8a72e423b864f611fbfaa9bbfac","kind":"owned","origin":"reused","reused_from":"0.8.2","sha256":"519cd7f5fd6a4dcca68cdb79beba0fb0b4c80798e18973df50f2789ff1537ac6","size":10231,"version":"0.1.1"},{"component":"mining-analytics","distribution":"aa-buh-mining-analytics","filename":"aa_buh_mining_analytics-0.2.3-py3-none-any.whl","import_name":"buh_mining_analytics","input_sha256":"c33d2958ddf9c3330c6f35ff52bf380eac9d569c9f196d7438a2594fae7f022d","kind":"owned","origin":"reused","reused_from":"0.8.2","sha256":"4e649f6ff3baec5e456ad3a4720a3b1a30191c5398db11ee43e366360373ab13","size":49548,"version":"0.2.3"},{"component":"moon-tax","distribution":"aa-buh-moon-tax","filename":"aa_buh_moon_tax-0.3.5-py3-none-any.whl","import_name":"buh_moon_tax","input_sha256":"bab95b630c34918db4a534255d69a6ce1c605b9b7ff2868a5d26c4713425dd44","kind":"owned","origin":"reused","reused_from":"0.8.2","sha256":"33d0312f0f62d71e314553f62c0252dcc0149d5fcb9076cc86d468bcf842121d","size":120812,"version":"0.3.5"},{"component":"structure-ops","distribution":"aa-buh-structure-ops","filename":"aa_buh_structure_ops-0.3.7-py3-none-any.whl","import_name":"buh_structure_ops","input_sha256":"f2cdc72cbba5f46503f4b2702b1c0d789eb9925b7f8211237a706c62ee5963f5","kind":"owned","origin":"built","sha256":"6d7be15a97aa52fdf8e3520376fd0e917ef46e8e9306e774899b1c809a56af46","size":87023,"version":"0.3.7"},{"component":"vps-health","distribution":"aa-buh-vps-health","filename":"aa_buh_vps_health-0.2.1-py3-none-any.whl","import_name":"buh_vps_health","input_sha256":"c293dbac50d4ba9813c4732a6b5856d42c2e589548e82cd3d2c4a1da2eab4176","kind":"owned","origin":"reused","reused_from":"0.8.2","sha256":"d53f7a39278d0e7449d117dcdc0f62f0ea6148f00df40785d7400a6fb528b76f","size":51471,"version":"0.2.1"}],"build":{"compatibility_sha256":"9c2bf892171a9abfa3cc0aff9a8df1e78e4e9cbc771ff282365d44fc36c8bbc4","platform_sha256":"d0cf856d780c9ced7d4db5c1ca23fda2d235324f80d245962e13f4791289875b","registry_sha256":"bc1fba1d34819ff46ae9f51aec9d24946fe95175ee41ee23e0d00de294a185db","test_run":"https://github.com/Fifty5D/B-UH-AllianceAuth/actions/runs/36953787916/attempts/1","tool_sha256":"2c84b7f8cbb77e48596f2afaf20f8cba65ade5ca341d29d60d529f3c27e24649"},"changes":[{"app_id":"platform","bump":"patch","fragment":"platform-v082-evidence-tooling.toml","kind":"fix","summary":"Bind guarded v0.8.2 recovery evidence to its exact published transition, recognize the verified PR86 receiver installation baseline, and collect the exact legacy scheduler container in private diagnostics."},{"app_id":"structure-ops","bump":"patch","fragment":"structure-ops-transient-sso-recovery.toml","kind":"fix","summary":"Keep incomplete SSO refreshes retryable so Member Audit resumes with existing tokens after an outage."}],"compatibility":{"sha256":"9c2bf892171a9abfa3cc0aff9a8df1e78e4e9cbc771ff282365d44fc36c8bbc4","values":{"applications":{"esi-history":{"depends_on":[],"distribution":"aa-buh-max-history","module":"buh_max_history","path":"apps/esi-history"},"memberaudit-autoreg":{"depends_on":[],"distribution":"aa-buh-memberaudit-autoreg","module":"buh_memberaudit_autoreg","path":"apps/memberaudit-autoreg"},"mining-analytics":{"depends_on":[],"distribution":"aa-buh-mining-analytics","module":"buh_mining_analytics","path":"apps/mining-analytics"},"moon-tax":{"depends_on":["structure-ops"],"distribution":"aa-buh-moon-tax","module":"buh_moon_tax","path":"apps/moon-tax"},"structure-ops":{"depends_on":[],"distribution":"aa-buh-structure-ops","module":"buh_structure_ops","path":"apps/structure-ops"},"vps-health":{"depends_on":["structure-ops"],"distribution":"aa-buh-vps-health","module":"buh_vps_health","path":"apps/vps-health"}},"policy":{"database_migrations_must_be_rollback_compatible":true,"legacy_bootstrap_may_skip_uninstalled_v2_releases":true,"production_requires_full_commit_sha":true,"production_requires_image_digests":true,"real_network_calls_in_tests":false,"release_bundles_are_append_only":true},"production_baseline":{"deployment_generation":"legacy-v1","platform_version":"0.3.3","release_commit":"e70a8ee713d358e2f0e3c1dc5b23305c863aa628","release_path":"releases/moon-tax/v0.3.3"},"production_runtime":{"base_image":"registry.gitlab.com/allianceauth/allianceauth/auth@sha256:4f7a6ebf0ea593220fbf38ace1e93f7cb25f7bb72224335e8d05ce48a10f11e7"},"runtime":{"aiopenapi3":"0.10.0","allianceauth":"5.4.0","celery":"5.6.3","django":"5.2.17","django_esi":"9.6.0","django_redis":"7.0.0","eveuniverse":"2.1.0","mariadb":"11.8","memberaudit":"5.0.4","node":"24.19.0","packaging":"25.0","playwright":"1.55.0","python":"3.12.13","pyyaml":"6.0.3","redis":"8","redis_python":"8.1.0","requests":"2.34.2"},"schema_version":1,"supply_chain":{"allowed_source_distributions":["celery-once","django-bootstrap-form","mysqlclient"],"lock_platform":"x86_64-manylinux_2_36","lock_python":"3.12.13"},"third_party":{"aa_moonmining":"3.1.0.post1","aa_structures":"4.0.3"},"tooling":{"build":"1.3.0","factory-boy":"3.3.3","pip":"26.2.1","pytest":"8.4.2","ruff":"0.16.5","setuptools":"84.0.0","twine":"6.2.0","uv":"0.11.33","wheel":"0.48.0"}}},"install_plan":{"filename":"INSTALL_PLAN.json","sha256":"96d5dd75162b19d9ef1d68713c5e0ca825868e42b95f223c042c9c4dac762ba7"},"platform_id":"buh-allianceauth","platform_version":"0.8.3","previous_release":{"manifest_sha256":"ee1120131935b78ba583072ad6c3b35ffb5585c98472f524214281174856f860","platform_version":"0.8.2","source_commit":"a8f60c83ddecf883cdefdd21f90dc426726bf5d3"},"schema_version":1,"source_commit":"fbcd829a42e566dc46cbf8e961142e22e4a07163"}
