{"artifacts":[{"component":"aa-moonmining","distribution":"aa-moonmining","filename":"aa_moonmining-3.1.0.post1-py3-none-any.whl","git_blob_sha":"381062cce2aa1d38dfc56123dff132198d0fd50e","kind":"third-party","origin":"reused","reused_from":"0.5.6","sha256":"aa4ddbc7da64151cd6d988d971d59462360e35a5111d47a3bf56d577f454bc13","size":326542,"version":"3.1.0.post1"},{"component":"aa-structures","distribution":"aa-structures","filename":"aa_structures-4.0.3-py3-none-any.whl","git_blob_sha":"95854c4ac5bc74d6acda97c08653d02e0cee75be","kind":"third-party","origin":"reused","reused_from":"0.5.6","sha256":"ba8493ef10a450198fa5ba3d8995e1ea661b74dca20d770beaa91bf005f558e3","size":965451,"version":"4.0.3"},{"component":"mining-analytics","distribution":"aa-buh-mining-analytics","filename":"aa_buh_mining_analytics-0.2.2-py3-none-any.whl","import_name":"buh_mining_analytics","input_sha256":"9598790d38bffab4a9a90718e5f0934e4e4b92e37694e1b6bbae3ea6a52f9b2f","kind":"owned","origin":"reused","reused_from":"0.5.6","sha256":"d3c6403a71ec8b25e47eda4665ab67b29cb5343425c4bee93a75a59676f9239e","size":49544,"version":"0.2.2"},{"component":"moon-tax","distribution":"aa-buh-moon-tax","filename":"aa_buh_moon_tax-0.3.4-py3-none-any.whl","import_name":"buh_moon_tax","input_sha256":"1b9b33781f99b206a7833c61362fca809348062437f981d5ae2549f71c7e1c91","kind":"owned","origin":"reused","reused_from":"0.5.6","sha256":"0e157845fa3d8c7ff74e95994cf8961fea6768e8fcdcc0b48db0297b36e4ae9e","size":120805,"version":"0.3.4"},{"component":"structure-ops","distribution":"aa-buh-structure-ops","filename":"aa_buh_structure_ops-0.3.3-py3-none-any.whl","import_name":"buh_structure_ops","input_sha256":"88e3491abad9c8c8faa7b86fd04341a313cbfc824b883daf2f67e385c4021680","kind":"owned","origin":"reused","reused_from":"0.5.6","sha256":"0c4c188d3dbcd034d4df0d553fec01c2b1b99828cb30fcbfeaf803619d7e45b6","size":76137,"version":"0.3.3"}],"build":{"compatibility_sha256":"3ff878ee1daba60a8eb9058c0c07f5277dce4699580accacc2bbcfbd64a71384","platform_sha256":"e91d2187c02f52c66b43643c218d05b08d3e7420bf2924c01d04b0cee5702d3e","registry_sha256":"cb19e2f115d089473f12d861366cc60258805f6a63b81f5f893bbc558fa46af5","test_run":"https://github.com/Fifty5D/B-UH-AllianceAuth/actions/runs/34075740289/attempts/1","tool_sha256":"e40091d21564b824bcc039cf406526d86623bd306d14cee5ba3c82b6dd836d44"},"changes":[{"app_id":"platform","bump":"patch","fragment":"feature-readiness-build-directory.toml","kind":"fix","summary":"Initialize fresh release workspaces before writing feature-readiness evidence."},{"app_id":"platform","bump":"patch","fragment":"nginx-mount-activation-docs.toml","kind":"fix","summary":"Correct the one-time Nginx mount activation and restoration runbook."},{"app_id":"platform","bump":"patch","fragment":"release-preflight-permissions.toml","kind":"fix","summary":"Fix automatic release preflight permissions and exact-head readiness handoff identity and label writes."},{"app_id":"platform","bump":"minor","fragment":"streamline-auth-delivery.toml","kind":"feature","summary":"Add exact-head Work readiness, synthetic previews, consolidated delivery stages, and candidate/active production switching with verified rollback."}],"compatibility":{"sha256":"3ff878ee1daba60a8eb9058c0c07f5277dce4699580accacc2bbcfbd64a71384","values":{"applications":{"mining-analytics":{"depends_on":[],"distribution":"aa-buh-mining-analytics","module":"buh_mining_analytics","path":"apps/mining-analytics"},"moon-tax":{"depends_on":["structure-ops"],"distribution":"aa-buh-moon-tax","module":"buh_moon_tax","path":"apps/moon-tax"},"structure-ops":{"depends_on":[],"distribution":"aa-buh-structure-ops","module":"buh_structure_ops","path":"apps/structure-ops"}},"policy":{"database_migrations_must_be_rollback_compatible":true,"legacy_bootstrap_may_skip_uninstalled_v2_releases":true,"production_requires_full_commit_sha":true,"production_requires_image_digests":true,"real_network_calls_in_tests":false,"release_bundles_are_append_only":true},"production_baseline":{"deployment_generation":"legacy-v1","platform_version":"0.3.3","release_commit":"e70a8ee713d358e2f0e3c1dc5b23305c863aa628","release_path":"releases/moon-tax/v0.3.3"},"production_runtime":{"base_image":"registry.gitlab.com/allianceauth/allianceauth/auth@sha256:cc7f6903582ecfb0aaa877edd23c70877136d03d5979543b09ffd815307ab5db"},"runtime":{"allianceauth":"5.2.0","celery":"5.6.3","django":"5.2.17","django_esi":"9.6.0","django_redis":"7.0.0","eveuniverse":"2.1.0","mariadb":"11.8","memberaudit":"5.0.4","node":"24.19.0","packaging":"25.0","playwright":"1.55.0","python":"3.12.13","pyyaml":"6.0.3","redis":"8","redis_python":"8.1.0","requests":"2.34.2"},"schema_version":1,"supply_chain":{"allowed_source_distributions":["celery-once","django-bootstrap-form","mysqlclient"],"lock_platform":"x86_64-manylinux_2_36","lock_python":"3.12.13"},"third_party":{"aa_moonmining":"3.1.0.post1","aa_structures":"4.0.3"},"tooling":{"build":"1.3.0","factory-boy":"3.3.3","pip":"26.2.1","pytest":"8.4.2","ruff":"0.16.5","setuptools":"84.0.0","twine":"6.2.0","uv":"0.11.33","wheel":"0.48.0"}}},"install_plan":{"filename":"INSTALL_PLAN.json","sha256":"eab01d7d7d43187f1709ab1e27f104b1cf23ce41aa39d7d2aa48c1c410fcd19e"},"platform_id":"buh-allianceauth","platform_version":"0.6.0","previous_release":{"manifest_sha256":"db22873f967c039d12ccf82e7330767d8c6b82f91b5654ca3f95854a8520821a","platform_version":"0.5.6","source_commit":"72e900c85791869e456931c9350bef794f8f9b9b"},"schema_version":1,"source_commit":"2ed0188255833c99e8acf9aa72f4d584533909ac"}
