{"artifacts":[{"component":"aa-moonmining","distribution":"aa-moonmining","filename":"aa_moonmining-3.1.0.post1-py3-none-any.whl","git_blob_sha":"381062cce2aa1d38dfc56123dff132198d0fd50e","kind":"third-party","origin":"reused","reused_from":"0.6.1","sha256":"aa4ddbc7da64151cd6d988d971d59462360e35a5111d47a3bf56d577f454bc13","size":326542,"version":"3.1.0.post1"},{"component":"aa-structures","distribution":"aa-structures","filename":"aa_structures-4.0.3-py3-none-any.whl","git_blob_sha":"95854c4ac5bc74d6acda97c08653d02e0cee75be","kind":"third-party","origin":"reused","reused_from":"0.6.1","sha256":"ba8493ef10a450198fa5ba3d8995e1ea661b74dca20d770beaa91bf005f558e3","size":965451,"version":"4.0.3"},{"component":"mining-analytics","distribution":"aa-buh-mining-analytics","filename":"aa_buh_mining_analytics-0.2.2-py3-none-any.whl","import_name":"buh_mining_analytics","input_sha256":"9598790d38bffab4a9a90718e5f0934e4e4b92e37694e1b6bbae3ea6a52f9b2f","kind":"owned","origin":"reused","reused_from":"0.6.1","sha256":"d3c6403a71ec8b25e47eda4665ab67b29cb5343425c4bee93a75a59676f9239e","size":49544,"version":"0.2.2"},{"component":"moon-tax","distribution":"aa-buh-moon-tax","filename":"aa_buh_moon_tax-0.3.4-py3-none-any.whl","import_name":"buh_moon_tax","input_sha256":"1b9b33781f99b206a7833c61362fca809348062437f981d5ae2549f71c7e1c91","kind":"owned","origin":"reused","reused_from":"0.6.1","sha256":"0e157845fa3d8c7ff74e95994cf8961fea6768e8fcdcc0b48db0297b36e4ae9e","size":120805,"version":"0.3.4"},{"component":"structure-ops","distribution":"aa-buh-structure-ops","filename":"aa_buh_structure_ops-0.3.4-py3-none-any.whl","import_name":"buh_structure_ops","input_sha256":"5ff8f67e2fa0bc1f5ff92ddcc7a6c1a1b59599bfa85b1792c3d77c818ab7121a","kind":"owned","origin":"reused","reused_from":"0.6.1","sha256":"1c8799bf901f7a2a0de6dc6df87726b9fd0b1e94179a5c856b15c9aa8a1dca58","size":78808,"version":"0.3.4"}],"build":{"compatibility_sha256":"3ff878ee1daba60a8eb9058c0c07f5277dce4699580accacc2bbcfbd64a71384","platform_sha256":"f543e589ba7a9293797a9e0378a41238123f257a3d6d6897b913f94d2769f415","registry_sha256":"b25d0561d138242bcc681ce0f4314f15b0a8d70fbe8bfa623a3040b3a567cf41","test_run":"https://github.com/Fifty5D/B-UH-AllianceAuth/actions/runs/34297290478/attempts/1","tool_sha256":"b95ffe91e1246bbb728759ffab6840db957d525489100d55a82004c799614004"},"changes":[{"app_id":"platform","bump":"patch","fragment":"coordinated-release-recovery.toml","kind":"fix","summary":"Restore the guarded release path with self-contained receiver tests, complete lineage checkout, exact owner diagnostics, root-private staging, umask-stable permissions, and a verified inventory handoff."}],"compatibility":{"sha256":"3ff878ee1daba60a8eb9058c0c07f5277dce4699580accacc2bbcfbd64a71384","values":{"applications":{"mining-analytics":{"depends_on":[],"distribution":"aa-buh-mining-analytics","module":"buh_mining_analytics","path":"apps/mining-analytics"},"moon-tax":{"depends_on":["structure-ops"],"distribution":"aa-buh-moon-tax","module":"buh_moon_tax","path":"apps/moon-tax"},"structure-ops":{"depends_on":[],"distribution":"aa-buh-structure-ops","module":"buh_structure_ops","path":"apps/structure-ops"}},"policy":{"database_migrations_must_be_rollback_compatible":true,"legacy_bootstrap_may_skip_uninstalled_v2_releases":true,"production_requires_full_commit_sha":true,"production_requires_image_digests":true,"real_network_calls_in_tests":false,"release_bundles_are_append_only":true},"production_baseline":{"deployment_generation":"legacy-v1","platform_version":"0.3.3","release_commit":"e70a8ee713d358e2f0e3c1dc5b23305c863aa628","release_path":"releases/moon-tax/v0.3.3"},"production_runtime":{"base_image":"registry.gitlab.com/allianceauth/allianceauth/auth@sha256:cc7f6903582ecfb0aaa877edd23c70877136d03d5979543b09ffd815307ab5db"},"runtime":{"allianceauth":"5.2.0","celery":"5.6.3","django":"5.2.17","django_esi":"9.6.0","django_redis":"7.0.0","eveuniverse":"2.1.0","mariadb":"11.8","memberaudit":"5.0.4","node":"24.19.0","packaging":"25.0","playwright":"1.55.0","python":"3.12.13","pyyaml":"6.0.3","redis":"8","redis_python":"8.1.0","requests":"2.34.2"},"schema_version":1,"supply_chain":{"allowed_source_distributions":["celery-once","django-bootstrap-form","mysqlclient"],"lock_platform":"x86_64-manylinux_2_36","lock_python":"3.12.13"},"third_party":{"aa_moonmining":"3.1.0.post1","aa_structures":"4.0.3"},"tooling":{"build":"1.3.0","factory-boy":"3.3.3","pip":"26.2.1","pytest":"8.4.2","ruff":"0.16.5","setuptools":"84.0.0","twine":"6.2.0","uv":"0.11.33","wheel":"0.48.0"}}},"deployment_recovery":{"baseline":{"manifest_sha256":"db22873f967c039d12ccf82e7330767d8c6b82f91b5654ca3f95854a8520821a","platform_version":"0.5.6","release_commit":"ce6bcf0aaa21338623aaf6d89d6bfc4d12ac51ba","release_ref":"release/platform-v0.5.6","source_commit":"72e900c85791869e456931c9350bef794f8f9b9b"},"intervening_releases":[{"manifest_sha256":"26f30066f2dd50a7bf4b650c48a6e2218e3f23f9cccf05fb018cf7ae083dee1d","platform_version":"0.6.0","release_commit":"ba99d9d82aff319ba073256b4841732aaf3998d2","release_ref":"release/platform-v0.6.0","source_commit":"2ed0188255833c99e8acf9aa72f4d584533909ac"},{"manifest_sha256":"80623060f7eb70144f89ef2b0edddc7bcdfa40ae59144f2de9178c72ea51bb33","platform_version":"0.6.1","release_commit":"43234a8c0b6371fdfc62b59fa75a7980924ac3a5","release_ref":"release/platform-v0.6.1","source_commit":"b97955bf8998b690e8ce4fc34086f5458487ab60"}],"policy_id":"production-v0.5.6-published-gap-20260907","policy_sha256":"ea3e45a9f2925276f272b8fb01fdb73ae925cc13ad1b2533a82a8f7216b6fc71"},"install_plan":{"filename":"INSTALL_PLAN.json","sha256":"45814745a63e965ca0f8b3124ffd0ac9e270a73e4bf47aa5e5e97adfcf62dbca"},"platform_id":"buh-allianceauth","platform_version":"0.6.2","previous_release":{"manifest_sha256":"80623060f7eb70144f89ef2b0edddc7bcdfa40ae59144f2de9178c72ea51bb33","platform_version":"0.6.1","source_commit":"b97955bf8998b690e8ce4fc34086f5458487ab60"},"schema_version":1,"source_commit":"4f98e7cb559ee1a9b269ea1f94938678d2dac4df"}
