{"artifacts":[{"component":"aa-moonmining","distribution":"aa-moonmining","filename":"aa_moonmining-3.1.0.post1-py3-none-any.whl","git_blob_sha":"381062cce2aa1d38dfc56123dff132198d0fd50e","kind":"third-party","origin":"reused","reused_from":"0.7.0","sha256":"aa4ddbc7da64151cd6d988d971d59462360e35a5111d47a3bf56d577f454bc13","size":326542,"version":"3.1.0.post1"},{"component":"aa-structures","distribution":"aa-structures","filename":"aa_structures-4.0.3-py3-none-any.whl","git_blob_sha":"95854c4ac5bc74d6acda97c08653d02e0cee75be","kind":"third-party","origin":"reused","reused_from":"0.7.0","sha256":"ba8493ef10a450198fa5ba3d8995e1ea661b74dca20d770beaa91bf005f558e3","size":965451,"version":"4.0.3"},{"component":"esi-history","distribution":"aa-buh-max-history","filename":"aa_buh_max_history-2.1.1-py3-none-any.whl","import_name":"buh_max_history","input_sha256":"ad121d2451edc0c70be695a7e16bf4ac105c8a52ff7727af3ee6465728d8757c","kind":"owned","origin":"built","sha256":"cae23b4a4165eea1e47a916270a84b513d501f2744bf2943f7f566dc97ab3c24","size":97957,"version":"2.1.1"},{"component":"mining-analytics","distribution":"aa-buh-mining-analytics","filename":"aa_buh_mining_analytics-0.2.3-py3-none-any.whl","import_name":"buh_mining_analytics","input_sha256":"c33d2958ddf9c3330c6f35ff52bf380eac9d569c9f196d7438a2594fae7f022d","kind":"owned","origin":"built","sha256":"4e649f6ff3baec5e456ad3a4720a3b1a30191c5398db11ee43e366360373ab13","size":49548,"version":"0.2.3"},{"component":"moon-tax","distribution":"aa-buh-moon-tax","filename":"aa_buh_moon_tax-0.3.5-py3-none-any.whl","import_name":"buh_moon_tax","input_sha256":"bab95b630c34918db4a534255d69a6ce1c605b9b7ff2868a5d26c4713425dd44","kind":"owned","origin":"built","sha256":"33d0312f0f62d71e314553f62c0252dcc0149d5fcb9076cc86d468bcf842121d","size":120812,"version":"0.3.5"},{"component":"structure-ops","distribution":"aa-buh-structure-ops","filename":"aa_buh_structure_ops-0.3.6-py3-none-any.whl","import_name":"buh_structure_ops","input_sha256":"8f754faee4d9685f9ca3638840f5fd26f3ff305685582a4300beb81c037207f6","kind":"owned","origin":"built","sha256":"cd4967ce1ade37bdc65a95a41f1fd62a7566f4fc6d736818f9251dfdd3a1d107","size":84792,"version":"0.3.6"}],"build":{"compatibility_sha256":"79ed7d91eea4d620d1c25fa5e6e21f8f81b885fe3c7ef397ec560f22c444ade3","platform_sha256":"d24c58634db3ce15853fc15a510a7d3b412feaccd727bacf1f55d5a954e6662c","registry_sha256":"f1763b12d41cf3839a694b60c51b168fb2774854eab96314d038883a5b00ecf2","test_run":"https://github.com/Fifty5D/B-UH-AllianceAuth/actions/runs/36372096108/attempts/1","tool_sha256":"173b0dc4815e7701e2cb27d0e159dfe0a74741fbe31c99a11b62a2e7cb4ca353"},"changes":[{"app_id":"esi-history","bump":"patch","fragment":"allianceauth-5-4-esi-history.toml","kind":"fix","summary":"Support Alliance Auth 5.4 and preserve complete public archive responses when EVE Ref catalogs lag."},{"app_id":"mining-analytics","bump":"patch","fragment":"allianceauth-5-4-mining-analytics.toml","kind":"internal","summary":"Validate Mining Analytics against the pinned Alliance Auth 5.4 runtime."},{"app_id":"moon-tax","bump":"patch","fragment":"allianceauth-5-4-moon-tax.toml","kind":"internal","summary":"Validate Moon Tax against the pinned Alliance Auth 5.4 runtime."},{"app_id":"platform","bump":"minor","fragment":"allianceauth-5-4-platform.toml","kind":"feature","summary":"Prepare the pinned Alliance Auth 5.4.0 runtime and independent private host diagnostics."},{"app_id":"structure-ops","bump":"patch","fragment":"allianceauth-5-4-structure-ops.toml","kind":"internal","summary":"Validate Structure Operations against the pinned Alliance Auth 5.4 runtime."},{"app_id":"platform","bump":"patch","fragment":"isolated-static-fallback.toml","kind":"fix","summary":"Keep previous-release web slots on an isolated read-only static snapshot while candidate assets are collected."},{"app_id":"platform","bump":"patch","fragment":"static-mismatch-diagnostics.toml","kind":"fix","summary":"Record bounded private evidence when a deployment finds changed previous-release static files."},{"app_id":"platform","bump":"patch","fragment":"sync-harness-consumed-fragment.toml","kind":"fix","summary":"Keep the historical recovery harness test runnable after release synchronization consumes its reviewed change fragment."}],"compatibility":{"sha256":"79ed7d91eea4d620d1c25fa5e6e21f8f81b885fe3c7ef397ec560f22c444ade3","values":{"applications":{"esi-history":{"depends_on":[],"distribution":"aa-buh-max-history","module":"buh_max_history","path":"apps/esi-history"},"mining-analytics":{"depends_on":[],"distribution":"aa-buh-mining-analytics","module":"buh_mining_analytics","path":"apps/mining-analytics"},"moon-tax":{"depends_on":["structure-ops"],"distribution":"aa-buh-moon-tax","module":"buh_moon_tax","path":"apps/moon-tax"},"structure-ops":{"depends_on":[],"distribution":"aa-buh-structure-ops","module":"buh_structure_ops","path":"apps/structure-ops"}},"policy":{"database_migrations_must_be_rollback_compatible":true,"legacy_bootstrap_may_skip_uninstalled_v2_releases":true,"production_requires_full_commit_sha":true,"production_requires_image_digests":true,"real_network_calls_in_tests":false,"release_bundles_are_append_only":true},"production_baseline":{"deployment_generation":"legacy-v1","platform_version":"0.3.3","release_commit":"e70a8ee713d358e2f0e3c1dc5b23305c863aa628","release_path":"releases/moon-tax/v0.3.3"},"production_runtime":{"base_image":"registry.gitlab.com/allianceauth/allianceauth/auth@sha256:4f7a6ebf0ea593220fbf38ace1e93f7cb25f7bb72224335e8d05ce48a10f11e7"},"runtime":{"aiopenapi3":"0.10.0","allianceauth":"5.4.0","celery":"5.6.3","django":"5.2.17","django_esi":"9.6.0","django_redis":"7.0.0","eveuniverse":"2.1.0","mariadb":"11.8","memberaudit":"5.0.4","node":"24.19.0","packaging":"25.0","playwright":"1.55.0","python":"3.12.13","pyyaml":"6.0.3","redis":"8","redis_python":"8.1.0","requests":"2.34.2"},"schema_version":1,"supply_chain":{"allowed_source_distributions":["celery-once","django-bootstrap-form","mysqlclient"],"lock_platform":"x86_64-manylinux_2_36","lock_python":"3.12.13"},"third_party":{"aa_moonmining":"3.1.0.post1","aa_structures":"4.0.3"},"tooling":{"build":"1.3.0","factory-boy":"3.3.3","pip":"26.2.1","pytest":"8.4.2","ruff":"0.16.5","setuptools":"84.0.0","twine":"6.2.0","uv":"0.11.33","wheel":"0.48.0"}}},"install_plan":{"filename":"INSTALL_PLAN.json","sha256":"0531091657ac145c9f98f5570bc4770a22241bfcc99b8fca2561dbde83c6a4ad"},"platform_id":"buh-allianceauth","platform_version":"0.8.0","previous_release":{"manifest_sha256":"c0d18918b96b1211100c001f39bfba8712d9ccd54b0b8cf96c4bd17592d8b00c","platform_version":"0.7.0","source_commit":"02a3e0ee84b667797e3521e9ade47e5cb3f3ec27"},"schema_version":1,"source_commit":"ffe6e1b1834f0c550cff001a2b7c14cd6839256e"}
