{"artifacts":[{"component":"aa-moonmining","distribution":"aa-moonmining","filename":"aa_moonmining-3.1.0.post1-py3-none-any.whl","git_blob_sha":"381062cce2aa1d38dfc56123dff132198d0fd50e","kind":"third-party","origin":"reused","reused_from":"0.5.3","sha256":"aa4ddbc7da64151cd6d988d971d59462360e35a5111d47a3bf56d577f454bc13","size":326542,"version":"3.1.0.post1"},{"component":"aa-structures","distribution":"aa-structures","filename":"aa_structures-4.0.3-py3-none-any.whl","git_blob_sha":"95854c4ac5bc74d6acda97c08653d02e0cee75be","kind":"third-party","origin":"reused","reused_from":"0.5.3","sha256":"ba8493ef10a450198fa5ba3d8995e1ea661b74dca20d770beaa91bf005f558e3","size":965451,"version":"4.0.3"},{"component":"mining-analytics","distribution":"aa-buh-mining-analytics","filename":"aa_buh_mining_analytics-0.2.1-py3-none-any.whl","import_name":"buh_mining_analytics","input_sha256":"acf1ecbc635d0984a5e7fe070336d29475f3949c3f6be98d05a6c8d56d21e2d2","kind":"owned","origin":"reused","reused_from":"0.5.3","sha256":"241807bed3805f363c0a84352de82278d16bed98f6562953feaae6784ee2a240","size":48876,"version":"0.2.1"},{"component":"moon-tax","distribution":"aa-buh-moon-tax","filename":"aa_buh_moon_tax-0.3.3-py3-none-any.whl","import_name":"buh_moon_tax","input_sha256":"0b63b460087c18312fb87db04ea687a490c0da215b99acef7a8796e363336271","kind":"owned","origin":"reused","reused_from":"0.5.3","sha256":"a50cf827c5c9fd979d8f287efc7d13eb8f1284a53f92c4e5f8c88528693bdbd9","size":120794,"version":"0.3.3"},{"component":"structure-ops","distribution":"aa-buh-structure-ops","filename":"aa_buh_structure_ops-0.3.2-py3-none-any.whl","import_name":"buh_structure_ops","input_sha256":"a9b6e716848aea2a551eaa1aadff5caaa877a22bc6b32f8d26a08be9536d5475","kind":"owned","origin":"built","sha256":"46a68d6c3bf84c983ae6bf42e226e980f931e106a27b1d5303d46525ce59a2ca","size":74373,"version":"0.3.2"}],"build":{"compatibility_sha256":"3ff878ee1daba60a8eb9058c0c07f5277dce4699580accacc2bbcfbd64a71384","platform_sha256":"6a5d056d86ae001c6230ee86d29570a6e3b39d34bac874bc7943cc77f857de42","registry_sha256":"7a256656db4f66d593e4ede52b964991cc8a2135ccfc2c15b541a5a5ddd43432","test_run":"https://github.com/Fifty5D/B-UH-AllianceAuth/actions/runs/33941161388/attempts/1","tool_sha256":"5790e918ddf911c0708da2493246a18c116bccb97d55d4112dbe868fafdaf965"},"changes":[{"app_id":"platform","bump":"patch","fragment":"20260905-console-style-browser-checks.toml","kind":"internal","summary":"Verify the shared console appearance against Moon Tax in the browser and exercise existing filter and schedule-dialog controls."},{"app_id":"structure-ops","bump":"patch","fragment":"20260905-moon-tax-console-style.toml","kind":"fix","summary":"Match Structure Operations, its schedule, ESI History Archive, and VPS Health to Moon Tax's palette, cards, typography, and controls without changing application behavior."}],"compatibility":{"sha256":"3ff878ee1daba60a8eb9058c0c07f5277dce4699580accacc2bbcfbd64a71384","values":{"applications":{"mining-analytics":{"depends_on":[],"distribution":"aa-buh-mining-analytics","module":"buh_mining_analytics","path":"apps/mining-analytics"},"moon-tax":{"depends_on":["structure-ops"],"distribution":"aa-buh-moon-tax","module":"buh_moon_tax","path":"apps/moon-tax"},"structure-ops":{"depends_on":[],"distribution":"aa-buh-structure-ops","module":"buh_structure_ops","path":"apps/structure-ops"}},"policy":{"database_migrations_must_be_rollback_compatible":true,"legacy_bootstrap_may_skip_uninstalled_v2_releases":true,"production_requires_full_commit_sha":true,"production_requires_image_digests":true,"real_network_calls_in_tests":false,"release_bundles_are_append_only":true},"production_baseline":{"deployment_generation":"legacy-v1","platform_version":"0.3.3","release_commit":"e70a8ee713d358e2f0e3c1dc5b23305c863aa628","release_path":"releases/moon-tax/v0.3.3"},"production_runtime":{"base_image":"registry.gitlab.com/allianceauth/allianceauth/auth@sha256:cc7f6903582ecfb0aaa877edd23c70877136d03d5979543b09ffd815307ab5db"},"runtime":{"allianceauth":"5.2.0","celery":"5.6.3","django":"5.2.17","django_esi":"9.6.0","django_redis":"7.0.0","eveuniverse":"2.1.0","mariadb":"11.8","memberaudit":"5.0.4","node":"24.19.0","packaging":"25.0","playwright":"1.55.0","python":"3.12.13","pyyaml":"6.0.3","redis":"8","redis_python":"8.1.0","requests":"2.34.2"},"schema_version":1,"supply_chain":{"allowed_source_distributions":["celery-once","django-bootstrap-form","mysqlclient"],"lock_platform":"x86_64-manylinux_2_36","lock_python":"3.12.13"},"third_party":{"aa_moonmining":"3.1.0.post1","aa_structures":"4.0.3"},"tooling":{"build":"1.3.0","factory-boy":"3.3.3","pip":"26.2.1","pytest":"8.4.2","ruff":"0.16.5","setuptools":"84.0.0","twine":"6.2.0","uv":"0.11.33","wheel":"0.48.0"}}},"install_plan":{"filename":"INSTALL_PLAN.json","sha256":"7214eda3fd7ad9a57ca530104ef42a08bfb6453783b50fc13950486f3b11ef0a"},"platform_id":"buh-allianceauth","platform_version":"0.5.4","previous_release":{"manifest_sha256":"05c166a49c2b32501955326a6c29a80ed574604cc603975849289d18a4437270","platform_version":"0.5.3","source_commit":"f03a142004b31550b3b697a5b79ac5a592c1f975"},"schema_version":1,"source_commit":"253019ef56ff0e748379e77e4ece9059ee89b941"}
